{
  "summary": {
    "avg_groundedness": 3.8,
    "avg_relevance": 3.8,
    "avg_standalone": 5.0,
    "total_samples": 5
  },
  "results": [
    {
      "user_input": "Who is Saeid Alihosseini",
      "retrieved_contexts": [
        "Saeid Alihosseini (Persian: سعيد علی حسينی, born 2 February 1988) is a former Iranian super heavyweight weightlifter. He failed two doping tests in 2006 and October 2009; the latter was originally a lifetime ban, but was reduced upon first appeal to 12 years; in 2011, the ban was reduced to eight years.",
        "A Broadband Imaging X-ray All-sky Survey, atau ABRIXAS adalah teleskop ruang berbasis sinar-X Jerman. Ini diluncurkan pada tanggal 28 April 1999 di kendaraan peluncuran Cosmos dari Kapustin Yar, Rusia, ke orbit Bumi. Orbit memiliki periapsis dari 549,0 kilometer (341,1 mil), sebuah apoapsis dari 598,0 kilometer (371,6 mil), kemiringan 48,0 ° dan eksentrisitas dari 0,00352, memberikan jangka waktu 96 menit.",
        "Sebagai pemain tim nasional Argentina, Messi menjadi pemain dengan penampilan dan gol terbanyak sepanjang masa bagi timnas Argentina. Di tingkat remaja, ia memenangkan Kejuaraan Dunia Remaja FIFA 2005, menyelesaikan turnamen dengan meraih penghargaan Bola Emas dan Sepatu Emas, dan mendapatkan medali emas Olimpiade pada Olimpiade Musim Panas 2008. Setelah melakukan debut di timnas senior pada Agustus 2005, Messi menjadi pemain Argentina termuda yang bermain dan mencetak gol di Piala Dunia FIFA tepatnya pada"
      ],
      "retrieved_chunks": [
        {
          "chunk_id": "Saeid Alihosseini.txt_0",
          "distance": 0.537007212638855,
          "metadata": {
            "file": "Saeid Alihosseini.txt"
          },
          "text_preview": "Saeid Alihosseini (Persian: سعيد علی حسينی, born 2 February 1988) is a former Iranian super heavyweight weightlifter. He failed two doping tests in 2006 and October 2009; the latter was originally a l…",
          "full_text": "Saeid Alihosseini (Persian: سعيد علی حسينی, born 2 February 1988) is a former Iranian super heavyweight weightlifter. He failed two doping tests in 2006 and October 2009; the latter was originally a lifetime ban, but was reduced upon first appeal to 12 years; in 2011, the ban was reduced to eight years."
        },
        {
          "chunk_id": "ABRIXAS.txt_0",
          "distance": 1.5339033603668213,
          "metadata": {
            "file": "ABRIXAS.txt"
          },
          "text_preview": "A Broadband Imaging X-ray All-sky Survey, atau ABRIXAS adalah teleskop ruang berbasis sinar-X Jerman. Ini diluncurkan pada tanggal 28 April 1999 di kendaraan peluncuran Cosmos dari Kapustin Yar, Rusia…",
          "full_text": "A Broadband Imaging X-ray All-sky Survey, atau ABRIXAS adalah teleskop ruang berbasis sinar-X Jerman. Ini diluncurkan pada tanggal 28 April 1999 di kendaraan peluncuran Cosmos dari Kapustin Yar, Rusia, ke orbit Bumi. Orbit memiliki periapsis dari 549,0 kilometer (341,1 mil), sebuah apoapsis dari 598,0 kilometer (371,6 mil), kemiringan 48,0 ° dan eksentrisitas dari 0,00352, memberikan jangka waktu 96 menit."
        },
        {
          "chunk_id": "Messi.txt_7",
          "distance": 1.7156996726989746,
          "metadata": {
            "file": "Messi.txt"
          },
          "text_preview": "Sebagai pemain tim nasional Argentina, Messi menjadi pemain dengan penampilan dan gol terbanyak sepanjang masa bagi timnas Argentina. Di tingkat remaja, ia memenangkan Kejuaraan Dunia Remaja FIFA 2005…",
          "full_text": "Sebagai pemain tim nasional Argentina, Messi menjadi pemain dengan penampilan dan gol terbanyak sepanjang masa bagi timnas Argentina. Di tingkat remaja, ia memenangkan Kejuaraan Dunia Remaja FIFA 2005, menyelesaikan turnamen dengan meraih penghargaan Bola Emas dan Sepatu Emas, dan mendapatkan medali emas Olimpiade pada Olimpiade Musim Panas 2008. Setelah melakukan debut di timnas senior pada Agustus 2005, Messi menjadi pemain Argentina termuda yang bermain dan mencetak gol di Piala Dunia FIFA tepatnya pada"
        }
      ],
      "response": "Saeid Alihosseini is a former Iranian super heavyweight weightlifter. Born on February 2, 1988, he made headlines due to failing two doping tests in 2006 and October 2009, ultimately leading to a significant reduction in his original ban from the latter instance.",
      "reference": "is a former Iranian super heavyweight weightlifter",
      "critiques": {
        "groundedness": {
          "score": 5.0,
          "evaluation": "Evaluation: The context provided contains information about Saeid Alihosseini in the first paragraph, which directly answers the question. The remaining text is unrelated to Saeid Alihosseini and pertains to a space telescope and a football player. Given that the relevant information about Saeid Alihosseini is clearly stated, including his name, birthdate, and career details, the question is directly and unambiguously answerable with the provided context.\n\nTotal rating: 5"
        },
        "relevance": {
          "score": 3.0,
          "evaluation": "Evaluation: The question \"Who is Saeid Alihosseini\" is a basic inquiry about a specific individual's identity. Without additional context, it's challenging to assess the usefulness of this question directly. However, such a question could be useful for users seeking information about a particular person, possibly in the context of sports, academia, arts, or other fields where individuals with this name might be notable. The usefulness can vary greatly depending on who Saeid Alihosseini is and what field they are known for. If Saeid Alihosseini is a public figure or has contributions worth noting, then this question could lead to valuable information for users interested in that specific area.\n\nTotal rating: 3"
        },
        "standalone": {
          "score": 5.0,
          "evaluation": "Evaluation: The question \"Who is Saeid Alihosseini\" is self-contained and does not require any additional context to understand what is being asked. It is a straightforward inquiry about a specific individual's identity, which can be answered with available information about the person. There are no implicit or explicit references to a specific document, context, or setting that would limit its understanding.\n\nTotal rating: 5"
        }
      }
    },
    {
      "user_input": "Apa itu ABRIXAS(A Broadband Imaging X-ray All-sky Survey)?",
      "retrieved_contexts": [
        "A Broadband Imaging X-ray All-sky Survey, atau ABRIXAS adalah teleskop ruang berbasis sinar-X Jerman. Ini diluncurkan pada tanggal 28 April 1999 di kendaraan peluncuran Cosmos dari Kapustin Yar, Rusia, ke orbit Bumi. Orbit memiliki periapsis dari 549,0 kilometer (341,1 mil), sebuah apoapsis dari 598,0 kilometer (371,6 mil), kemiringan 48,0 ° dan eksentrisitas dari 0,00352, memberikan jangka waktu 96 menit.",
        "pasien ke rumah sakit sehari sebelum operasi.[1] Pasien harus menjalani tes darah, rontgen dada, atau elektrokardiogram untuk menilai kebugaran anestesi.[1] MRI juga dilakukan sebelum operasi.[1] Tombol-tombol dan scan membantu ahli bedah saraf untuk secara akurat menghilangkan tumor hipofisis menggunakan komputer visualisasi canggih.[1] Pasien dikunjungi oleh ahli anestesi (dokter yang menempatkan pasien untuk tidur selama operasi) dan ia diminta untuk berpuasa (tidak makan atau minum) dari tengah malam",
        "Baterai teleskop sengaja ditagih berlebihan dan menghancurkan tiga hari setelah misi dimulai. Ketika upaya untuk berkomunikasi dengan satelit ketika panel surya yang diterangi oleh sinar matahari gagal, proyek $ 20.000.000 ditinggalkan."
      ],
      "retrieved_chunks": [
        {
          "chunk_id": "ABRIXAS.txt_0",
          "distance": 0.5997539758682251,
          "metadata": {
            "file": "ABRIXAS.txt"
          },
          "text_preview": "A Broadband Imaging X-ray All-sky Survey, atau ABRIXAS adalah teleskop ruang berbasis sinar-X Jerman. Ini diluncurkan pada tanggal 28 April 1999 di kendaraan peluncuran Cosmos dari Kapustin Yar, Rusia…",
          "full_text": "A Broadband Imaging X-ray All-sky Survey, atau ABRIXAS adalah teleskop ruang berbasis sinar-X Jerman. Ini diluncurkan pada tanggal 28 April 1999 di kendaraan peluncuran Cosmos dari Kapustin Yar, Rusia, ke orbit Bumi. Orbit memiliki periapsis dari 549,0 kilometer (341,1 mil), sebuah apoapsis dari 598,0 kilometer (371,6 mil), kemiringan 48,0 ° dan eksentrisitas dari 0,00352, memberikan jangka waktu 96 menit."
        },
        {
          "chunk_id": "hipfisektomi.txt_3",
          "distance": 1.6135298013687134,
          "metadata": {
            "file": "hipfisektomi.txt"
          },
          "text_preview": "pasien ke rumah sakit sehari sebelum operasi.[1] Pasien harus menjalani tes darah, rontgen dada, atau elektrokardiogram untuk menilai kebugaran anestesi.[1] MRI juga dilakukan sebelum operasi.[1] Tomb…",
          "full_text": "pasien ke rumah sakit sehari sebelum operasi.[1] Pasien harus menjalani tes darah, rontgen dada, atau elektrokardiogram untuk menilai kebugaran anestesi.[1] MRI juga dilakukan sebelum operasi.[1] Tombol-tombol dan scan membantu ahli bedah saraf untuk secara akurat menghilangkan tumor hipofisis menggunakan komputer visualisasi canggih.[1] Pasien dikunjungi oleh ahli anestesi (dokter yang menempatkan pasien untuk tidur selama operasi) dan ia diminta untuk berpuasa (tidak makan atau minum) dari tengah malam"
        },
        {
          "chunk_id": "ABRIXAS.txt_1",
          "distance": 1.659998893737793,
          "metadata": {
            "file": "ABRIXAS.txt"
          },
          "text_preview": "Baterai teleskop sengaja ditagih berlebihan dan menghancurkan tiga hari setelah misi dimulai. Ketika upaya untuk berkomunikasi dengan satelit ketika panel surya yang diterangi oleh sinar matahari gaga…",
          "full_text": "Baterai teleskop sengaja ditagih berlebihan dan menghancurkan tiga hari setelah misi dimulai. Ketika upaya untuk berkomunikasi dengan satelit ketika panel surya yang diterangi oleh sinar matahari gagal, proyek $ 20.000.000 ditinggalkan."
        }
      ],
      "response": "ABRIXAS, atau Broadband Imaging X-ray All-sky Survey, adalah sebuah teleskop ruang berbasis sinar-X yang dikembangkan oleh Jerman. Teleskop ini diluncurkan pada tanggal 28 April 1999 menggunakan kendaraan peluncuran Cosmos dari Kapustin Yar, Rusia. Dengan orbit Bumi yang telah ditentukan, ABRIXAS memiliki periapsis sekitar 549 kilometer, apoapsis sekitar 598 kilometer, kemiringan sebesar 48°, dan eksentrisitas sangat kecil, sehingga memungkinkan teleskop ini untuk mengorbit Bumi dalam waktu 96 menit.\n\nSayangnya, pengembangan teleskop ini terhambat oleh kegagalan teknis yang menghancurkan baterainya hanya 3 hari setelah misi diluncurkan. Upaya untuk berkomunikasi dengan teleskop juga gagal karena panel surya yang diterangi oleh sinar matahari tidak berfungsi normal. Oleh karena itu, proyek ini yang nilainya mencapai $20.000.000 ditinggalkan.",
      "reference": "A Broadband Imaging X-ray All-sky Survey, atau ABRIXAS adalah teleskop ruang berbasis sinar-X Jerman",
      "critiques": {
        "groundedness": {
          "score": 5.0,
          "evaluation": "Evaluation: Konteks yang diberikan menjelaskan tentang ABRIXAS sebagai teleskop ruang berbasis sinar-X Jerman, yang diluncurkan pada tanggal 28 April 1999. Informasi ini secara langsung menjawab pertanyaan tentang apa itu ABRIXAS. Meskipun ada informasi tambahan yang tidak relevan dengan pertanyaan, jawaban dasar tentang ABRIXAS dapat ditemukan dalam teks.\n\nTotal rating: 5"
        },
        "relevance": {
          "score": 4.0,
          "evaluation": "Evaluation: The question is asking about a specific scientific project or mission, namely ABRIXAS. This suggests that the person asking the question is interested in learning about a particular topic in the field of astronomy or astrophysics. The question is clear and concise, which makes it easy to understand and provide a relevant answer. The topic itself is likely to be of interest to users seeking information on space-related projects, astronomy, or scientific missions.\n\nTotal rating: 4 \n\nThe question is quite specific and shows a clear interest in a particular topic. However, it does not have a broad appeal or applicability to a wide range of users. Nonetheless, for users interested in astronomy, astrophysics, or space exploration, this question could be quite useful. The rating of 4 reflects its usefulness to a targeted audience rather than the general public."
        },
        "standalone": {
          "score": 5.0,
          "evaluation": "Evaluation: The question is self-contained and clearly defines what is being asked about, which is the definition or explanation of ABRIXAS, a specific astronomical survey. The acronym is expanded within the question, indicating that the question itself provides enough context for understanding what is being asked, without requiring external information.\n\nTotal rating: 5"
        }
      }
    },
    {
      "user_input": "Apa yang dimaksud dengan batuan lereng (rimrock)?",
      "retrieved_contexts": [
        "Istilah \"Rimrock\" (Batuan Lereng/Tepi) umumnya merujuk pada lapisan batuan keras yang menonjol di tepi atas sebuah tebing, lereng, atau ngarai. Batuan ini seringkali membentuk tebing curam atau tebing gantung karena ketahanannya terhadap erosi lebih tinggi dibandingkan lapisan di bawahnya.",
        "ia menjadi pemain sepak bola pertama dan atlet olahraga beregu pertama yang memenangkan penghargaan tersebut.",
        "Zein Hasjmy adalah Wali Kota Banda Aceh kelima setelah menggantikan Teuku Usman Yacoub dan menjabat pada tahun 1973 sampai 1978. Pada tahun 1978,Zein Hasjmy digantikan oleh Djakfar Achmad."
      ],
      "retrieved_chunks": [
        {
          "chunk_id": "batuan lereng (rimrock).txt_0",
          "distance": 0.5868387818336487,
          "metadata": {
            "file": "batuan lereng (rimrock).txt"
          },
          "text_preview": "Istilah \"Rimrock\" (Batuan Lereng/Tepi) umumnya merujuk pada lapisan batuan keras yang menonjol di tepi atas sebuah tebing, lereng, atau ngarai. Batuan ini seringkali membentuk tebing curam atau tebing…",
          "full_text": "Istilah \"Rimrock\" (Batuan Lereng/Tepi) umumnya merujuk pada lapisan batuan keras yang menonjol di tepi atas sebuah tebing, lereng, atau ngarai. Batuan ini seringkali membentuk tebing curam atau tebing gantung karena ketahanannya terhadap erosi lebih tinggi dibandingkan lapisan di bawahnya."
        },
        {
          "chunk_id": "Messi.txt_11",
          "distance": 0.7700838446617126,
          "metadata": {
            "file": "Messi.txt"
          },
          "text_preview": "ia menjadi pemain sepak bola pertama dan atlet olahraga beregu pertama yang memenangkan penghargaan tersebut.",
          "full_text": "ia menjadi pemain sepak bola pertama dan atlet olahraga beregu pertama yang memenangkan penghargaan tersebut."
        },
        {
          "chunk_id": "Drs. Zein Hasjmy.txt_0",
          "distance": 0.926565945148468,
          "metadata": {
            "file": "Drs. Zein Hasjmy.txt"
          },
          "text_preview": "Zein Hasjmy adalah Wali Kota Banda Aceh kelima setelah menggantikan Teuku Usman Yacoub dan menjabat pada tahun 1973 sampai 1978. Pada tahun 1978,Zein Hasjmy digantikan oleh Djakfar Achmad.",
          "full_text": "Zein Hasjmy adalah Wali Kota Banda Aceh kelima setelah menggantikan Teuku Usman Yacoub dan menjabat pada tahun 1973 sampai 1978. Pada tahun 1978,Zein Hasjmy digantikan oleh Djakfar Achmad."
        }
      ],
      "response": "Batuan lereng, atau lebih dikenal sebagai \"Rimrock\", adalah lapisan batuan keras yang menonjol di tepi atas sebuah tebing, lereng, atau ngarai. Batuan ini cenderung lebih tahan terhadap erosi daripada lapisan di bawahnya, sehingga membentuk tebing curam atau bahkan tebing gantung.",
      "reference": "Batuan lereng adalah dinding batu tipis di tepi atas dataran tinggi atau ngarai yang biasanya menutupi batu yang lebih lembut.",
      "critiques": {
        "groundedness": {
          "score": 5.0,
          "evaluation": "Evaluation: Konteks yang diberikan menjelaskan tentang definisi dan karakteristik dari \"Rimrock\" atau \"Batuan Lereng/Tepi\", sehingga memungkinkan jawaban yang jelas dan tidak ambigu untuk pertanyaan tentang apa yang dimaksud dengan batuan lereng (rimrock).\n\nTotal rating: 5"
        },
        "relevance": {
          "score": 4.0,
          "evaluation": "Evaluation: Pertanyaan ini cukup spesifik dan terkait dengan istilah geologi, yaitu \"batuan lereng\" atau \"rimrock\". Rimrock adalah istilah yang digunakan dalam geologi untuk menggambarkan batuan yang terletak di lereng atau tepi suatu formasi batuan yang lebih besar. Pertanyaan ini memungkinkan pengguna untuk memahami definisi dan konsep yang terkait dengan rimrock, sehingga dapat membantu mereka dalam mencari informasi yang lebih lanjut tentang topik ini.\n\nTotal rating: 4"
        },
        "standalone": {
          "score": 5.0,
          "evaluation": "Evaluation: The question is self-contained and does not require any additional context to be understood. The term \"batuan lereng\" and its English equivalent \"rimrock\" are specific geological terms that can be defined and explained on their own.\n\nTotal rating: 5"
        }
      }
    },
    {
      "user_input": "Apa itu operasi Hipofisektomi?",
      "retrieved_contexts": [
        "untuk tidur selama operasi) dan ia diminta untuk berpuasa (tidak makan atau minum) dari tengah malam sebelum hari operasi.[1] Jika hipofisektomi ini dilakukan melalui hidung, pasien disarankan untuk berlatih bernapas melalui mulut karena hidung akan dikemas setelah operasi.[1]",
        "tumor dan mencoba untuk menyelamatkan sebagian kelenjar.[1] Operasi hipofisis dilakukan oleh ahli bedah saraf.[2] Yang harus dipersiapkan oleh pasien adalah tetap sehat dan percaya bahwa ahli bedah akan melakukan pekerjaannya dengan sangat baik seperti biasa.[2] Persetujuan bedah informasi sangatlah penting agar pasien sepenuhnya yakin kebutuhan untuk operasi dan hasil yang diharapkan.[2] Pemeriksaan pasien ke rumah sakit sehari sebelum operasi.[1] Pasien harus menjalani tes darah, rontgen dada, atau",
        "pasien ke rumah sakit sehari sebelum operasi.[1] Pasien harus menjalani tes darah, rontgen dada, atau elektrokardiogram untuk menilai kebugaran anestesi.[1] MRI juga dilakukan sebelum operasi.[1] Tombol-tombol dan scan membantu ahli bedah saraf untuk secara akurat menghilangkan tumor hipofisis menggunakan komputer visualisasi canggih.[1] Pasien dikunjungi oleh ahli anestesi (dokter yang menempatkan pasien untuk tidur selama operasi) dan ia diminta untuk berpuasa (tidak makan atau minum) dari tengah malam"
      ],
      "retrieved_chunks": [
        {
          "chunk_id": "hipfisektomi.txt_4",
          "distance": 0.8066883683204651,
          "metadata": {
            "file": "hipfisektomi.txt"
          },
          "text_preview": "untuk tidur selama operasi) dan ia diminta untuk berpuasa (tidak makan atau minum) dari tengah malam sebelum hari operasi.[1] Jika hipofisektomi ini dilakukan melalui hidung, pasien disarankan untuk b…",
          "full_text": "untuk tidur selama operasi) dan ia diminta untuk berpuasa (tidak makan atau minum) dari tengah malam sebelum hari operasi.[1] Jika hipofisektomi ini dilakukan melalui hidung, pasien disarankan untuk berlatih bernapas melalui mulut karena hidung akan dikemas setelah operasi.[1]"
        },
        {
          "chunk_id": "hipfisektomi.txt_2",
          "distance": 0.9376564621925354,
          "metadata": {
            "file": "hipfisektomi.txt"
          },
          "text_preview": "tumor dan mencoba untuk menyelamatkan sebagian kelenjar.[1] Operasi hipofisis dilakukan oleh ahli bedah saraf.[2] Yang harus dipersiapkan oleh pasien adalah tetap sehat dan percaya bahwa ahli bedah ak…",
          "full_text": "tumor dan mencoba untuk menyelamatkan sebagian kelenjar.[1] Operasi hipofisis dilakukan oleh ahli bedah saraf.[2] Yang harus dipersiapkan oleh pasien adalah tetap sehat dan percaya bahwa ahli bedah akan melakukan pekerjaannya dengan sangat baik seperti biasa.[2] Persetujuan bedah informasi sangatlah penting agar pasien sepenuhnya yakin kebutuhan untuk operasi dan hasil yang diharapkan.[2] Pemeriksaan pasien ke rumah sakit sehari sebelum operasi.[1] Pasien harus menjalani tes darah, rontgen dada, atau"
        },
        {
          "chunk_id": "hipfisektomi.txt_3",
          "distance": 1.0118452310562134,
          "metadata": {
            "file": "hipfisektomi.txt"
          },
          "text_preview": "pasien ke rumah sakit sehari sebelum operasi.[1] Pasien harus menjalani tes darah, rontgen dada, atau elektrokardiogram untuk menilai kebugaran anestesi.[1] MRI juga dilakukan sebelum operasi.[1] Tomb…",
          "full_text": "pasien ke rumah sakit sehari sebelum operasi.[1] Pasien harus menjalani tes darah, rontgen dada, atau elektrokardiogram untuk menilai kebugaran anestesi.[1] MRI juga dilakukan sebelum operasi.[1] Tombol-tombol dan scan membantu ahli bedah saraf untuk secara akurat menghilangkan tumor hipofisis menggunakan komputer visualisasi canggih.[1] Pasien dikunjungi oleh ahli anestesi (dokter yang menempatkan pasien untuk tidur selama operasi) dan ia diminta untuk berpuasa (tidak makan atau minum) dari tengah malam"
        }
      ],
      "response": "Operasi Hipofisektomi adalah prosedur bedah yang dilakukan untuk menghilangkan tumor pada kelenjar hipofisis. Kelenjar hipofisis merupakan kelenjar kecil yang terletak di dasar otak dan berperan penting dalam mengatur hormon tubuh. Jika tumor muncul di kelenjar hipofisis, operasi Hipofisektomi biasanya dilakukan oleh ahli bedah saraf untuk menghilangkannya dan menghindari potensi bahaya bagi kehidupan pasien.\n\nDalam operasi Hipofisektomi, pasien harus melakukan beberapa persiapan penting, seperti menjalani tes darah, rontgen dada, atau elektrokardiogram untuk menilai kebugaran anestesi. Pasien juga harus berpuasa dari tengah malam sebelum operasi dan berlatih bernapas melalui mulut jika operasi dilakukan melalui hidung.\n\nTujuan utama dari operasi Hipofisektomi adalah untuk menghilangkan tumor hipofisis dan menghindari kerusakan pada kelenjar lainnya. Dengan menggunakan teknik bedah yang canggih, ahli bedah dapat memvisualisasi area operasi dengan menggunakan MRI dan komputer visualisasi canggih untuk menghilangkan tumor dengan akurat.\n\nDalam beberapa kasus, operasi Hipofisektomi dapat dilakukan untuk menghilangkan tumor hipofisis yang tidak berbahaya, tetapi pasien harus melakukan persiapan yang tepat sebelum operasi dan berbicara dengan dokter anestesi untuk mendapatkan informasi yang akurat tentang operasi.",
      "reference": "Hipofisektomi adalah operasi pengangkatan kelenjar pituitari",
      "critiques": {
        "groundedness": {
          "score": 2.0,
          "evaluation": "Evaluation: Konteks yang diberikan menjelaskan tentang prosedur operasi hipofisektomi, termasuk persiapan pasien sebelum operasi, seperti berpuasa, menjalani tes darah, rontgen dada, dan elektrokardiogram. Namun, konteks tidak secara langsung menjelaskan definisi dari operasi hipofisektomi itu sendiri. \n\nTotal rating: 2"
        },
        "relevance": {
          "score": 4.0,
          "evaluation": "Evaluation: Operasi Hipofisektomi adalah prosedur medis yang relatif spesifik dan jarang dibahas dalam pengetahuan umum. Pertanyaan ini memungkinkan pengguna untuk mencari informasi tentang definisi, tujuan, prosedur, dan kemungkinan implikasi dari operasi tersebut. Informasi tentang operasi semacam ini bisa sangat berguna bagi pasien yang membutuhkan atau sedang mempertimbangkan operasi tersebut, serta bagi tenaga medis yang mencari detail tentang prosedur ini.\n\nTotal rating: 4"
        },
        "standalone": {
          "score": 5.0,
          "evaluation": "Evaluation: The question \"Apa itu operasi Hipofisektomi?\" is asking about the definition or explanation of a specific medical operation called \"Hipofisektomi\". The term \"Hipofisektomi\" seems to be related to a medical procedure, and a person with access to medical documentation or a dictionary could understand what it refers to. There is no implicit or explicit mention of a specific context, setting, or document that would make the question dependent on additional information.\n\nTotal rating: 5"
        }
      }
    },
    {
      "user_input": "Siapa wali kota banda Aceh kelima?",
      "retrieved_contexts": [
        "Zein Hasjmy adalah Wali Kota Banda Aceh kelima setelah menggantikan Teuku Usman Yacoub dan menjabat pada tahun 1973 sampai 1978. Pada tahun 1978,Zein Hasjmy digantikan oleh Djakfar Achmad.",
        "ia menjadi pemain sepak bola pertama dan atlet olahraga beregu pertama yang memenangkan penghargaan tersebut.",
        "d'Or dan enam Sepatu Emas Eropa. Di tim nasional negara ia juga telah memenangkan 2 Copa América dan 1 Piala Dunia FIFA. Ia juga merupakan salah satu pemain dengan trofi terbanyak dalam sejarah sepak bola, dengan 45 trofi."
      ],
      "retrieved_chunks": [
        {
          "chunk_id": "Drs. Zein Hasjmy.txt_0",
          "distance": 0.6996409893035889,
          "metadata": {
            "file": "Drs. Zein Hasjmy.txt"
          },
          "text_preview": "Zein Hasjmy adalah Wali Kota Banda Aceh kelima setelah menggantikan Teuku Usman Yacoub dan menjabat pada tahun 1973 sampai 1978. Pada tahun 1978,Zein Hasjmy digantikan oleh Djakfar Achmad.",
          "full_text": "Zein Hasjmy adalah Wali Kota Banda Aceh kelima setelah menggantikan Teuku Usman Yacoub dan menjabat pada tahun 1973 sampai 1978. Pada tahun 1978,Zein Hasjmy digantikan oleh Djakfar Achmad."
        },
        {
          "chunk_id": "Messi.txt_11",
          "distance": 0.9512313008308411,
          "metadata": {
            "file": "Messi.txt"
          },
          "text_preview": "ia menjadi pemain sepak bola pertama dan atlet olahraga beregu pertama yang memenangkan penghargaan tersebut.",
          "full_text": "ia menjadi pemain sepak bola pertama dan atlet olahraga beregu pertama yang memenangkan penghargaan tersebut."
        },
        {
          "chunk_id": "Messi.txt_1",
          "distance": 1.053682804107666,
          "metadata": {
            "file": "Messi.txt"
          },
          "text_preview": "d'Or dan enam Sepatu Emas Eropa. Di tim nasional negara ia juga telah memenangkan 2 Copa América dan 1 Piala Dunia FIFA. Ia juga merupakan salah satu pemain dengan trofi terbanyak dalam sejarah sepak …",
          "full_text": "d'Or dan enam Sepatu Emas Eropa. Di tim nasional negara ia juga telah memenangkan 2 Copa América dan 1 Piala Dunia FIFA. Ia juga merupakan salah satu pemain dengan trofi terbanyak dalam sejarah sepak bola, dengan 45 trofi."
        }
      ],
      "response": "Wali Kota Banda Aceh kelima adalah Zein Hasjmy.",
      "reference": "Drs. Zein Hasjmy",
      "critiques": {
        "groundedness": {
          "score": 2.0,
          "evaluation": "Evaluation: Konteks yang diberikan tidak relevan dengan pertanyaan tentang wali kota Banda Aceh kelima. Informasi tentang Zein Hasjmy sebagai Wali Kota Banda Aceh kelima diberikan, tetapi kemudian diikuti oleh informasi yang tidak relevan tentang seorang pemain sepak bola. \n\nTotal rating: 2"
        },
        "relevance": {
          "score": 4.0,
          "evaluation": "Evaluation: The question \"Siapa wali kota banda Aceh kelima?\" translates to \"Who is the fifth mayor of Banda Aceh?\" This question is specific and seeks a particular piece of information about the historical leadership of Banda Aceh. It implies that the questioner is looking for accurate and possibly verifiable data that could be found in a reliable source such as a historical record, government archives, or a reputable encyclopedia. The specificity of the question makes it potentially useful for users interested in the history or governance of Banda Aceh.\n\nTotal rating: 4"
        },
        "standalone": {
          "score": 5.0,
          "evaluation": "Evaluation: The question \"Siapa wali kota banda Aceh kelima?\" translates to \"Who is the fifth mayor of Banda Aceh?\" This question is self-contained and does not require any additional context to understand what is being asked. The subject (the fifth mayor of Banda Aceh) is clearly defined, and an operator with access to historical data or documentation about the mayors of Banda Aceh would be able to find the answer.\n\nTotal rating: 5"
        }
      }
    }
  ]
}